{
  "format": "homi",
  "version": 1,
  "bundleType": "import",
  "bundleId": "bundle_max_boundary_v1",
  "title": "경계값 테스트 번들",
  "description": "제목과 메타 문자열이 긴 경계값 성격의 테스트 번들",
  "datasets": [
    {
      "id": "schedule_boundary_1",
      "engineId": "schedule",
      "engineSchemaVersion": 1,
      "title": "긴 설명 일정 세트",
      "meta": {
        "description": "aaaaaaaaaaaaaaaaaaaaaaaaaaaaaaaaaaaaaaaaaaaaaaaaaaaaaaaaaaaaaaaaaaaaaaaaaaaaaaaaaaaaaaaaaaaaaaaaaaaaaaaaaaaaaaaaaaaaaaaaaaaaaaaa"
      },
      "items": [
        {
          "repeat": "daily",
          "title": "긴 노트 일정",
          "timeStart": "12:30",
          "notes": "bbbbbbbbbbbbbbbbbbbbbbbbbbbbbbbbbbbbbbbbbbbbbbbbbbbbbbbbbbbbbbbbbbbbbbbbbbbbbbbbbbbbbbbbbbbbbbbbbbbbbbbbbbbbbbbbbbbbbbbbbbbbbbbb"
        },
        {
          "repeat": "yearly",
          "monthDay": "12-31",
          "title": "연말 일정",
          "timeStart": "23:59"
        }
      ]
    },
    {
      "id": "dictation_boundary_1",
      "engineId": "dictation",
      "engineSchemaVersion": 1,
      "title": "긴 받아쓰기 세트",
      "items": [
        {
          "word": "extraordinary",
          "meaning": "비범한",
          "example": "This boundary fixture remains within the v1 schema limits."
        }
      ]
    }
  ]
}
