{
  "format": "homi",
  "version": 1,
  "bundleType": "import",
  "bundleId": "bundle_audio_fallback_v1",
  "title": "오디오 폴백 테스트 번들",
  "datasets": [
    {
      "id": "schedule_audio_fallback_1",
      "engineId": "schedule",
      "engineSchemaVersion": 1,
      "title": "오디오 우선 알림",
      "items": [
        {
          "repeat": "daily",
          "title": "오디오 파일 알림",
          "timeStart": "11:00",
          "audioUrl": "https://example.com/audio/fallback.mp3"
        }
      ]
    }
  ]
}
