{
  "format": "homi",
  "version": 1,
  "bundleType": "import",
  "bundleId": "bundle_quiet_mode_v1",
  "title": "조용히 모드 테스트 번들",
  "datasets": [
    {
      "id": "schedule_quiet_1",
      "engineId": "schedule",
      "engineSchemaVersion": 1,
      "title": "조용히 알림",
      "items": [
        {
          "repeat": "daily",
          "title": "집중 시간",
          "timeStart": "10:00",
          "notes": "조용히 모드면 재생되면 안 됨"
        }
      ]
    }
  ]
}
